{
  "meta": {
    "raw_message": "2025-10-09 11:02:55 ERROR unauthorized request from IP 212.68.10.15"
  },
  "timestamp": "2025-10-09T11:02:55.000Z",
  "event_type": "http_response",
  "service": "api-gateway",
  "env": "production",
  "outcome": "failure",
  "level": "error",
  "category": "security",
  "endpoint": "/v1/admin/users",
  "action": "GET",
  "http_status": 403,
  "latency_ms": 3.2,
  "error": {
    "type": "UNAUTHORIZED_ACCESS",
    "message": "Access denied for IP 212.68.10.15"
  },
  "error_code": "E005",
  "safety_flags": ["security"],
  "metadata": {
    "source_ip": "212.68.10.xxx"
  }
}
