{
  "meta": {
    "raw_message": "Internal cleanup job completed in 8567.4ms"
  },
  "timestamp": "2025-10-08T18:00:00.000Z",
  "event_type": "http_response",
  "service": "scheduler",
  "env": "production",
  "outcome": "success",
  "level": "info",
  "category": "scheduler",
  "endpoint": "/internal/cleanup-jobs",
  "action": "INTERNAL",
  "latency_ms": 8567.4,
  "request_id": "req_sched_789"
}
