{
  "meta": {
    "raw_message": "[2025-10-08T10:15:32.100Z] payment-service v2.1.4 started successfully in 1.234s",
    "parse": {
      "parser_name": "service_lifecycle_parser",
      "parser_version": "1.0.0",
      "pattern_id": "startup_standard",
      "confidence": 0.95
    }
  },
  "timestamp": "2025-10-08T10:15:32.100Z",
  "event_type": "startup",
  "service": "payment-service",
  "env": "production",
  "outcome": "success",
  "level": "info",
  "category": "deployment",
  "version": "2.1.4",
  "duration_ms": 1234
}
