{
  "meta": {
    "raw_message": "OPTIONS /v1/users 204 1.2ms"
  },
  "timestamp": "2025-10-08T22:00:00.000Z",
  "event_type": "http_request",
  "service": "api-gateway",
  "env": "production",
  "outcome": "success",
  "level": "info",
  "endpoint": "/v1/users",
  "action": "OPTIONS",
  "http_status": 204,
  "latency_ms": 1.2,
  "request_id": "req_preflight_001"
}
