{
  "meta": {
    "raw_message": "2025-10-08 14:23:45.123 INFO [api-gateway] GET /v1/users/123 returned 200 in 45.2ms",
    "parse": {
      "parser_name": "nginx_combined_parser",
      "parser_version": "1.0.0",
      "pattern_id": "http_response_standard",
      "confidence": 0.98
    }
  },
  "timestamp": "2025-10-08T14:23:45.123Z",
  "event_type": "http_response",
  "service": "api-gateway",
  "env": "production",
  "outcome": "success",
  "level": "info",
  "category": "service",
  "endpoint": "/v1/users/123",
  "action": "GET",
  "http_status": 200,
  "latency_ms": 45.2
}
