{
  "meta": {
    "raw_message": "2025-10-08 16:45:30 WARN [data-pipeline] POST /api/process-batch timed out after 30s (30000ms elapsed)",
    "parse": {
      "parser_name": "timeout_parser",
      "parser_version": "1.0.0",
      "pattern_id": "timeout_standard",
      "confidence": 0.92
    }
  },
  "timestamp": "2025-10-08T16:45:30.000Z",
  "event_type": "http_response",
  "service": "data-pipeline",
  "env": "production",
  "outcome": "failure",
  "level": "warn",
  "category": "core_api",
  "sub_category": "network",
  "endpoint": "/api/process-batch",
  "action": "POST",
  "http_status": 504,
  "latency_ms": 30000,
  "error": "Request timed out after 30000ms",
  "error_code": "ULOG-NET-001"
}
