{
  "meta": {
    "raw_message": "payment-service v2.1.4 started in 1.234s"
  },
  "timestamp": "2025-10-09T10:00:00.000Z",
  "event_type": "startup",
  "service": "payment-service",
  "env": "production",
  "outcome": "success",
  "level": "info",
  "category": "deployment",
  "version": "2.1.4",
  "duration_ms": 1234
}
