{
  "meta": {
    "raw_message": "DELETE /v1/resources/old-data 204 456.7ms"
  },
  "timestamp": "2025-10-08T21:00:00.000Z",
  "event_type": "http_response",
  "service": "resource-manager",
  "env": "production",
  "outcome": "success",
  "level": "info",
  "endpoint": "/v1/resources/old-data",
  "action": "DELETE",
  "http_status": 204,
  "latency_ms": 456.7,
  "request_id": "req_delete_001"
}
