{
  "meta": {
    "raw_message": "POST /api/process-batch timed out after 30000ms"
  },
  "timestamp": "2025-10-08T16:45:30.000Z",
  "event_type": "http_response",
  "service": "data-pipeline",
  "env": "production",
  "outcome": "failure",
  "level": "error",
  "category": "network",
  "endpoint": "/api/process-batch",
  "action": "POST",
  "http_status": 504,
  "latency_ms": 30000,
  "request_id": "req_batch_123",
  "error": {
    "type": "UPSTREAM_TIMEOUT",
    "message": "Database query exceeded 30s timeout"
  },
  "error_code": "E002",
  "metadata": {
    "upstream_services": ["postgresql", "redis"],
    "retry_count": 3
  }
}
