{
  "meta": {
    "raw_message": "[BUILD] npm install completed in 45.6s (342 packages)"
  },
  "timestamp": "2025-10-09T11:00:00.000Z",
  "event_type": "dependency_install",
  "service": "ml-training",
  "component": "model-builder",
  "env": "development",
  "outcome": "success",
  "level": "info",
  "category": "deployment",
  "duration_ms": 45600,
  "metadata": {
    "package_manager": "npm",
    "packages_installed": 342
  }
}
