{
  "meta": {
    "raw_message": "2025-10-08 22:00:00.000 INFO [cv-service] POST /v1/classify/image 200 456.7ms"
  },
  "timestamp": "2025-10-08T22:00:00.000Z",
  "event_type": "http_response",
  "service": "cv-service",
  "env": "production",
  "outcome": "success",
  "level": "info",
  "category": "cv",
  "sub_category": "inference",
  "endpoint": "/v1/classify/image",
  "action": "POST",
  "http_status": 200,
  "latency_ms": 456.7,
  "safety_flags": [
    "flag_bias_visual"
  ],
  "metadata": {
    "model_name": "resnet50",
    "model_version": "v2.1",
    "confidence": 0.94
  }
}
